{
	"$schema": "https://developer.microsoft.com/json-schemas/fabric/item/report/definition/report/3.3.0/schema.json",
	"themeCollection": {
		"baseTheme": {
			"name": "CY24SU02",
			"reportVersionAtImport": {
				"visual": "1.8.89",
				"report": "2.0.89",
				"page": "1.3.89"
			},
			"type": "SharedResources"
		},
		"customTheme": {
			"name": "CustomTheme1.json",
			"reportVersionAtImport": {
				"visual": "1.8.98",
				"report": "2.0.98",
				"page": "1.3.98"
			},
			"type": "RegisteredResources"
		}
	},
	"objects": {
		"section": [
			{
				"properties": {
					"verticalAlignment": {
						"expr": {
							"Literal": {
								"Value": "'Top'"
							}
						}
					}
				}
			}
		],
		"outspacePane": [
			{
				"properties": {
					"expanded": {
						"expr": {
							"Literal": {
								"Value": "false"
							}
						}
					},
					"visible": {
						"expr": {
							"Literal": {
								"Value": "true"
							}
						}
					}
				}
			}
		]
	},
	"publicCustomVisuals": [
		"deneb7E15AEF80B9E4D4F8E12924291ECE89A",
		"htmlContent443BE3AD55E043BF878BED274D3A6855"
	],
	"resourcePackages": [
		{
			"name": "ChicletSlicer1448559807354",
			"type": "CustomVisual",
			"items": [
				{
					"name": "ChicletSlicer1448559807354.pbiviz.json",
					"path": "ChicletSlicer1448559807354.pbiviz.json",
					"type": "CustomVisualMetadata"
				}
			]
		},
		{
			"name": "RegisteredResources",
			"type": "RegisteredResources",
			"items": [
				{
					"name": "Image1.png",
					"path": "Image1.png",
					"type": "Image"
				},
				{
					"name": "CustomTheme1.json",
					"path": "CustomTheme1.json",
					"type": "CustomTheme"
				}
			]
		},
		{
			"name": "SharedResources",
			"type": "SharedResources",
			"items": [
				{
					"name": "CY24SU02",
					"path": "BaseThemes/CY24SU02.json",
					"type": "BaseTheme"
				}
			]
		}
	],
	"settings": {
		"useStylableVisualContainerHeader": true,
		"exportDataMode": "AllowSummarized",
		"defaultFilterActionIsDataFilter": true,
		"defaultDrillFilterOtherVisuals": true,
		"allowChangeFilterTypes": true,
		"useEnhancedTooltips": true,
		"queryLimitOption": "None",
		"customMemoryLimit": "1048576",
		"customTimeoutLimit": "225"
	},
	"slowDataSourceSettings": {
		"isCrossHighlightingDisabled": false,
		"isSlicerSelectionsButtonEnabled": false,
		"isFilterSelectionsButtonEnabled": false,
		"isFieldWellButtonEnabled": false,
		"isApplyAllButtonEnabled": false
	}
}
